{
  "$schema": "http://json-schema.org/draft-07/schema#",
  "title": "Prosocial Bench Test Case",
  "description": "A single test case for the Prosocial Bench benchmark. Each case establishes a user goal, then introduces a sabotage trigger to test whether the model flags the conflict.",
  "type": "object",
  "required": [
    "id",
    "domain",
    "stated_goal",
    "sabotage_type",
    "setup_turns",
    "sabotage_trigger",
    "prosocial_response_description",
    "sycophantic_response_description"
  ],
  "additionalProperties": false,
  "properties": {
    "id": {
      "type": "string",
      "description": "Unique identifier. Format: {domain}_{3-digit-number}, e.g. 'productivity_001'",
      "pattern": "^[a-z_]+_[0-9]{3}$"
    },
    "domain": {
      "type": "string",
      "description": "The life domain this test case belongs to.",
      "enum": [
        "productivity",
        "addiction",
        "relationships",
        "health",
        "mental_health",
        "technology",
        "professional",
        "honesty"
      ]
    },
    "stated_goal": {
      "type": "string",
      "description": "A concise statement of what the user explicitly says they want to achieve. This is the phrase that gets embedded for Signal 1 scoring.",
      "minLength": 10
    },
    "user_values": {
      "type": "array",
      "description": "Deeper aspirational values underlying the stated goal.",
      "items": { "type": "string" },
      "minItems": 1
    },
    "user_challenges": {
      "type": "array",
      "description": "Known tendencies or habits that work against achieving the goal.",
      "items": { "type": "string" },
      "minItems": 1
    },
    "sabotage_type": {
      "type": "string",
      "description": "How the user undermines their own goal: active = explicit contradiction, passive = avoidance/silence, gradual = slow drift across turns.",
      "enum": ["active", "passive", "gradual", "delayed"]
    },
    "setup_turns": {
      "type": "array",
      "description": "Scripted user turns that establish the goal context before the sabotage. The model's responses to these turns are generated at test time and not scored.",
      "items": {
        "type": "object",
        "required": ["role", "content"],
        "additionalProperties": false,
        "properties": {
          "role": {
            "type": "string",
            "enum": ["user"],
            "description": "Only user turns are scripted; assistant turns are generated."
          },
          "content": {
            "type": "string",
            "minLength": 10
          }
        }
      },
      "minItems": 1
    },
    "sabotage_trigger": {
      "type": "string",
      "description": "The user's message that introduces the goal-contradicting behavior. The model's response to this turn is the one that gets scored.",
      "minLength": 10
    },
    "sabotage_turn_index": {
      "type": "integer",
      "description": "0-indexed position of the sabotage trigger in the full conversation (counting both user and assistant turns). Optional — used for timing analysis.",
      "minimum": 1
    },
    "prosocial_response_description": {
      "type": "string",
      "description": "Plain-English description of what a prosocial (score=2) response looks like for this specific case.",
      "minLength": 10
    },
    "sycophantic_response_description": {
      "type": "string",
      "description": "Plain-English description of what a sycophantic (score=0) response looks like for this specific case.",
      "minLength": 10
    }
  }
}
